บริษัท บิ๊กซี ซูเปอร์เซ็นเตอร์ จำกัด (มหาชน),,,,,,,
จำนวน,รหัสสินค้า,รายการสินค้า,หน่วยบรรจุ,ราคาต่อหน่วย (รวม VAT),ส่วนลด บาท,VAT CODE,จำนวนเงิน (รวม VAT)
1.000,8850157510493,บัตเตอร์กาแฟ 70 กรัม (หน่วย:1ชิ้น),,12.00,0.00,,12.00
1.000,8850580100032,โซกี้ชิอกโกแลตแคชชิว 456(หน่วย:1ชิ้น),,12.00,0.00,,12.00
1.000,6923655599009,ดินสอกต 0.5 @990 PK1(หน่วย:1ชิ้น),,14.00,0.00,,14.00
1.000,3474370505040,เพนเทลไส้ดินสอกตขนาด0.5มม12ไส้ (หน่วย:1ชิ้น),,18.00,0.00,,18.00
1.000,8858729210642,ปลอกสวม ตราม้า แฟนซี (หน่วย:1ชิ้น),,32.00,0.00,,32.00
ยอดเงินชำระ,,,,,,,88.00
